{
  "messageSchemaVersion": "2.0",
  "ifcDataBusVersion": "0.2",
  
  "messageType": "System.Acknowledgment",
  "messageId": "msg-20251121-104530-mno345",
  "correlationId": "LCA-2025-001",
  "idempotencyKey": "ack-lca-2025-001-systemb-20251121-104530",
  
  "sequenceNumber": 102,
  "previousSequenceNumber": 101,
  
  "timestamp": "2025-11-21T10:45:30Z",
  "priority": 3,
  
  "sender": {
    "systemId": "SystemB",
    "systemType": "LCAService",
    "version": "1.5.2"
  },
  
  "routing": {
    "publishedOn": "ifc-data-bus/ack/LCA-2025-001",
    "replyTo": null,
    "ttl": 60
  },
  
  "tracing": {
    "traceId": "7ad8e9f0a1b2c3d4e5f6a7b8c9d0e1f2",
    "spanId": "e5f6a7b8c9d0e1f2",
    "parentSpanId": "d4e5f6a7b8c9d0e1"
  },
  
  "acknowledges": {
    "messageId": "msg-20251121-103000-def456",
    "messageType": "de.din.DIN_EN15978_2012_10.Command.CalculateBuildingLca",
    "correlationId": "LCA-2025-001",
    "sequenceNumber": 50,
    "systemId": "SystemD"
  },
  
  "payload": {
    "status": "processing",
    "receivedAt": "2025-11-21T10:30:01Z",
    "startedAt": "2025-11-21T10:30:05Z",
    "progress": {
      "percentage": 65,
      "currentStep": "Calculating module B4 (Replacement)",
      "totalSteps": 6,
      "completedSteps": 4,
      "estimatedCompletionAt": "2025-11-21T10:46:00Z"
    },
    "metadata": {
      "processingNode": "lca-worker-03",
      "queuePosition": null,
      "retryCount": 0
    }
  }
}

